{
  "id": "shared-timeline",
  "title": "One cursor, several kinds of evidence",
  "summary": "Graph, Table, and Map use the same log-time context, so a moment can be inspected without translating three unrelated clocks in your head.",
  "blocks": [
    {
      "type": "paragraph",
      "text": "A Blackbox event does not always carry its own timestamp. Airframe preserves event order and, where necessary, uses the latest valid main-frame time as its context. That makes an event useful on the timeline, but it does not manufacture precision the log never recorded."
    },
    {
      "type": "list",
      "style": "bulleted",
      "items": [
        "Graph is the quickest way to see relationships and timing across signals.",
        "Table is the place for exact displayed samples and decoded event rows.",
        "Map binds the same moment to the most recent retained GPS route point."
      ]
    },
    {
      "type": "callout",
      "tone": "limit",
      "title": "The cursor is precise; the source may not be",
      "text": "A gap, low logging rate, sparse GPS samples, or an event without a payload timestamp limits what can honestly be concluded. Zooming farther in does not negotiate with physics—or missing bytes."
    }
  ],
  "sources": [
    {"label": "Shared timeline implementation", "path": "Airframe/App/Airframe/App/DocumentHome/Content/LogTimelineStore.swift"},
    {"label": "Table event ordering", "path": "Airframe/App/Airframe/App/DocumentHome/Content/Table/TableModel.swift"},
    {"label": "GPS event projection", "path": "Airframe/Packages/BlackboxAnalysis/Sources/BlackboxAnalysis/GPS/AnalysisGPSRoute.swift"},
    {"label": "Blackbox event timing evidence", "path": ".agents/knowledge/BLACKBOX_FORMAT_AND_COMPATIBILITY.md"}
  ],
  "reviewedAgainst": {
    "appVersion": "0.1.0",
    "betaflightVersion": "2026.6.1",
    "betaflightCommit": "6dbc4218f",
    "reviewDate": "2026-08-11"
  }
}
