{
  "id": "configuration-provenance",
  "title": "Recorded settings outrank remembered settings",
  "summary": "Airframe separates values written into the selected log header from an associated imported configuration, and labels fallback or mismatch instead of quietly blending them.",
  "blocks": [
    {
      "type": "paragraph",
      "text": "A Blackbox header is evidence from the selected recording. An imported configuration can fill some presentation gaps, but it may be older, newer, incomplete, or simply from another moment. Airframe marks older fallback and mismatch conditions where those distinctions matter."
    },
    {
      "type": "list",
      "style": "bulleted",
      "items": [
        "Prefer the selected segment's header for PID, filter, motor, receiver, and logging facts.",
        "Use Configuration detail to inspect separately captured settings and their provenance.",
        "Do not treat a displayed overlay as proof that a filter behaved perfectly; it shows the configured boundary, not the complete physical result."
      ]
    }
  ],
  "sources": [
    {"label": "Overview configuration presentation", "path": "Airframe/App/Airframe/App/DocumentHome/Content/Overview/RecordedDataDetailView.swift"},
    {"label": "Spectrum configuration provenance", "path": "Airframe/App/Airframe/App/DocumentHome/Content/Spectrum/SpectrumFilterConfiguration.swift"},
    {"label": "PID provenance decision", "path": "knowledge/PID_TUNING_PRINCIPLES.md"},
    {"label": "Flight-controller configuration capture", "path": "Airframe/Packages/FlightController/Sources/FlightController/"}
  ],
  "reviewedAgainst": {
    "appVersion": "0.1.0",
    "betaflightVersion": "2026.6.1",
    "betaflightCommit": "6dbc4218f",
    "reviewDate": "2026-08-11"
  }
}
